Group_ID,Category,Question,Reponse Attendue,Context Info
32,Premiers secours,"Si un dégagement d'urgence est nécessaire, où doit être déplacée la victime ?",Dans un endroit suffisamment éloigné du danger.,"Dégagement : Uniquement si danger réel, immédiat et non contrôlable (incendie, explosion). Sinon, ne touchez pas la victime."
33,Vérification intérieure,Montrez la commande permettant d'actionner le régulateur de vitesse.,Le candidat montre la commande.,Entretien technique : Savoir vérifier son véhicule est indispensable pour garantir sa sécurité et celle des autres.
33,Sécurité routière,"Sans actionner la commande, comment le désactiver rapidement ?",En appuyant sur la pédale de frein ou d'embrayage.,Sécurité Routière : Ces questions testent votre capacité à évaluer les risques et à adapter votre comportement.
33,Premiers secours,"Sur autoroute, comment indiquer avec précision les lieux de l'accident ?","Numéro d'autoroute, sens de circulation et point kilométrique.","Premiers Secours : Agir vite et bien peut sauver une vie. Rappelez-vous de l'acronyme P.A.S. (Protéger, Alerter, Secourir)."
34,Vérification extérieure,Ouvrez la trappe à carburant et/ou vérifiez la bonne fermeture du bouchon.,Le candidat actionne la trappe/vérifie le bouchon.,Entretien technique : Savoir vérifier son véhicule est indispensable pour garantir sa sécurité et celle des autres.
34,Sécurité routière,Quelles sont les précautions à prendre lors du remplissage ?,"Arrêter le moteur, ne pas fumer, ne pas téléphoner.",Sécurité Routière : Ces questions testent votre capacité à évaluer les risques et à adapter votre comportement.
34,Premiers secours,Pourquoi l'alerte doit-elle être rapide et précise ?,Pour apporter les moyens adaptés dans le délai le plus court.,Alerte : Le SAIP avertit d'un danger grave (sirène montante/descendante). Mettez-vous à l'abri et écoutez la radio.
35,Vérification intérieure,"Sans l'actionner, montrez la commande de l'avertisseur sonore.",Le candidat montre la commande.,Entretien technique : Savoir vérifier son véhicule est indispensable pour garantir sa sécurité et celle des autres.
35,Sécurité routière,Dans quel cas peut-on l'utiliser en agglomération ?,En cas de danger immédiat.,Sécurité Routière : Ces questions testent votre capacité à évaluer les risques et à adapter votre comportement.
35,Premiers secours,Pourquoi ne pas laisser une personne en perte de connaissance sur le dos ?,Risque d'étouffement par liquides ou chute de la langue.,"Premiers Secours : Agir vite et bien peut sauver une vie. Rappelez-vous de l'acronyme P.A.S. (Protéger, Alerter, Secourir)."
36,Vérification extérieure,Montrez où s'effectue le remplissage de l'huile moteur.,Le candidat montre le bouchon de remplissage.,"Niveau d'huile : Toujours moteur froid et sur plat. Trop d'huile peut casser le moteur, pas assez provoque un serrage."
36,Sécurité routière,Quel est le risque d'un manque d'huile moteur ?,Risque de détérioration ou de casse du moteur.,Sécurité Routière : Ces questions testent votre capacité à évaluer les risques et à adapter votre comportement.
36,Premiers secours,L'utilisation d'un DAE sur une victime qui n'est pas en arrêt cardiaque présente-t-elle un risque ?,"Non, car il se déclenche uniquement en cas d'arrêt cardiaque.",Arrêt Cardiaque : Chaque minute compte. Massez le thorax et utilisez un DAE si disponible.
37,Vérification intérieure,Montrez la commande de désactivation de l'airbag passager.,Le candidat montre la commande.,Airbag : Toujours désactiver l'airbag passager si vous installez un siège bébé DOS à la route à l'avant.
37,Sécurité routière,Dans quelle situation doit-on le désactiver ?,Transport d'un enfant à l'avant dans un siège auto dos à la route.,Sécurité Routière : Ces questions testent votre capacité à évaluer les risques et à adapter votre comportement.
37,Premiers secours,Quelles sont les conditions pour réaliser le dégagement d'urgence ?,"Victime visible, facile à atteindre, rien ne doit gêner.","Dégagement : Uniquement si danger réel, immédiat et non contrôlable (incendie, explosion). Sinon, ne touchez pas la victime."
38,Vérification extérieure,"Donnez la pression préconisée pour les pneus arrières, véhicule chargé.",Le candidat lit la plaque indicative.,"Pneumatiques : Vérifiez l'état (flancs, hernies) et l'usure (témoins). Sous-gonflage = éclatement et surconsommation."
38,Sécurité routière,À quelle fréquence vérifier la pression des pneus ?,Chaque mois et avant chaque long trajet.,Pneus : À vérifier une fois par mois à froid. Un pneu sous-gonflé chauffe et peut exploser.
38,Premiers secours,Comment et pourquoi protéger une zone de danger ?,En la délimitant clairement pour protéger les victimes et éviter un sur-accident.,"PAS : Protéger est la 1ère étape. Balisez la zone (gilet, triangle) pour éviter un sur-accident."
39,Vérification intérieure,Montrez le voyant signalant l'absence de bouclage de la ceinture conducteur.,Le candidat montre le voyant (personnage rouge).,Sécurité passive : La ceinture doit être plaquée et non vrillée. Elle évite l'éjection en cas de choc.
39,Sécurité routière,À partir de quel âge un enfant peut-il être installé à l'avant ?,10 ans (sauf exceptions).,"Enfants : Jusqu'à 10 ans, l'installation à l'arrière est obligatoire (sauf exceptions). La sécurité enfant bloque l'ouverture intérieure."
39,Premiers secours,Comment est composé le signal d'alerte SAIP ?,3 cycles successifs (SNA) et un signal continu (fin).,Alerte : Le SAIP avertit d'un danger grave (sirène montante/descendante). Mettez-vous à l'abri et écoutez la radio.
40,Vérification extérieure,Vérifiez le fonctionnement de l'éclairage de la plaque d'immatriculation arrière.,Le candidat vérifie si elle est allumée.,Entretien technique : Savoir vérifier son véhicule est indispensable pour garantir sa sécurité et celle des autres.
40,Sécurité routière,Un défaut d'éclairage entraîne-t-il une contre-visite ?,Oui.,Sécurité Routière : Ces questions testent votre capacité à évaluer les risques et à adapter votre comportement.
40,Premiers secours,Quelles sont les trois informations à transmettre aux secours ?,"Numéro de téléphone, nature et localisation précise.","Urgences : 15 (SAMU), 18 (Pompiers), 112 (Europe). Soyez précis sur le lieu et l'état des victimes."
41,Vérification intérieure,Vérifiez la présence de l'attestation d'assurance et de sa vignette.,Le candidat montre la carte verte et la vignette.,Entretien technique : Savoir vérifier son véhicule est indispensable pour garantir sa sécurité et celle des autres.
41,Sécurité routière,Quels sont les deux autres documents obligatoires ?,Certificat d'immatriculation (carte grise) et permis de conduire.,Sécurité Routière : Ces questions testent votre capacité à évaluer les risques et à adapter votre comportement.
41,Premiers secours,Qu'est-ce qu'une hémorragie ?,Perte de sang prolongée qui ne s'arrête pas.,Hémorragie : Appuyez fort sur la plaie avec un tissu propre. Le but est d'arrêter la fuite de sang.
42,Vérification extérieure,Indiquez où se situe la sécurité enfant sur l'une des portières arrière.,Le candidat montre l'emplacement.,Entretien technique : Savoir vérifier son véhicule est indispensable pour garantir sa sécurité et celle des autres.
42,Sécurité routière,"Si enclenchée, est-il possible d'ouvrir la portière depuis l'extérieur ?",Oui.,Sécurité Routière : Ces questions testent votre capacité à évaluer les risques et à adapter votre comportement.
42,Premiers secours,Quels sont les risques pour une personne victime d'une hémorragie ?,Détresse circulatoire ou arrêt cardiaque.,Hémorragie : Appuyez fort sur la plaie avec un tissu propre. Le but est d'arrêter la fuite de sang.
43,Vérification intérieure,Allumez le(s) feu(x) de brouillard arrière et montrez le voyant.,Le candidat montre le voyant (orange).,Tableau de bord : Rouge = Danger/Arrêt. Orange = Anomalie/Attention. Vert/Bleu = Fonctionnement.
43,Sécurité routière,Pouvez-vous les utiliser par forte pluie ?,Non.,Sécurité Routière : Ces questions testent votre capacité à évaluer les risques et à adapter votre comportement.
43,Premiers secours,Quels sont les signes d'un arrêt cardiaque ?,"Ne répond pas, ne réagit pas, ne respire pas ou respiration anormale.",Arrêt Cardiaque : Chaque minute compte. Massez le thorax et utilisez un DAE si disponible.
44,Vérification extérieure,"Avec l'assistance, contrôlez l'état et le fonctionnement des feux de recul.",Le candidat vérifie si propre et fonctionnel.,Éclairage : Vérifiez régulièrement la propreté et le fonctionnement. Un feu grillé = mauvaise perception par les autres.
44,Sécurité routière,Quelles sont leurs deux utilités ?,Éclairer la zone la nuit et avertir les autres de la manœuvre.,Sécurité Routière : Ces questions testent votre capacité à évaluer les risques et à adapter votre comportement.
44,Premiers secours,Qu'est-ce qu'un défibrillateur automatisé externe (DAE) ?,Appareil qui rétablit une activité cardiaque normale.,Arrêt Cardiaque : Chaque minute compte. Massez le thorax et utilisez un DAE si disponible.
45,Vérification intérieure,Montrez comment régler la hauteur de l'appui-tête conducteur.,Le candidat montre le réglage.,"Appui-tête : Réglé au sommet de la tête, il évite le coup du lapin lors d'un choc arrière."
45,Sécurité routière,Quelle est son utilité ?,Retenir le mouvement de la tête en cas de choc.,Sécurité Routière : Ces questions testent votre capacité à évaluer les risques et à adapter votre comportement.
45,Premiers secours,Par quels moyens doit être réalisée l'alerte des secours ?,"Téléphone portable, fixe ou borne d'appel d'urgence.",Alerte : Le SAIP avertit d'un danger grave (sirène montante/descendante). Mettez-vous à l'abri et écoutez la radio.
46,Vérification extérieure,"Avec l'assistance, contrôlez l'état et le fonctionnement des feux de stop.",Le candidat vérifie si propre et fonctionnel.,Éclairage : Vérifiez régulièrement la propreté et le fonctionnement. Un feu grillé = mauvaise perception par les autres.
46,Sécurité routière,Quelle est la conséquence en cas de panne des feux de stop ?,"Manque d'information pour les suivants, risque de collision.",Visibilité : Ne pas régler ses feux éblouit les autres usagers et peut provoquer un accident frontal.
46,Premiers secours,"Lors d'un appel, pourquoi attendre l'autorisation pour raccrocher ?",Il peut conseiller ou guider dans les gestes.,"Premiers Secours : Agir vite et bien peut sauver une vie. Rappelez-vous de l'acronyme P.A.S. (Protéger, Alerter, Secourir)."
47,Vérification intérieure,De quelle couleur est le voyant du feu de brouillard arrière ?,Orange.,Tableau de bord : Rouge = Danger/Arrêt. Orange = Anomalie/Attention. Vert/Bleu = Fonctionnement.
47,Sécurité routière,Quelle est la différence entre un voyant orange et rouge ?,Rouge : anomalie ou danger. Orange : élément important.,Sécurité Routière : Ces questions testent votre capacité à évaluer les risques et à adapter votre comportement.
47,Premiers secours,Qu'est-ce qu'un arrêt cardiaque ?,Le cœur ne fonctionne plus ou de façon anarchique.,Arrêt Cardiaque : Chaque minute compte. Massez le thorax et utilisez un DAE si disponible.
48,Vérification extérieure,"Ouvrez et refermez le capot, puis vérifiez sa bonne fermeture.",Le candidat effectue la manœuvre.,Entretien technique : Savoir vérifier son véhicule est indispensable pour garantir sa sécurité et celle des autres.
48,Sécurité routière,Quel est le risque d'une mauvaise fermeture du capot ?,Ouverture pouvant entraîner un accident.,Sécurité Routière : Ces questions testent votre capacité à évaluer les risques et à adapter votre comportement.
48,Premiers secours,Quel est le risque d'un arrêt cardiaque sans intervention ?,Mort de la victime en quelques minutes.,Arrêt Cardiaque : Chaque minute compte. Massez le thorax et utilisez un DAE si disponible.
49,Vérification intérieure,Montrez la commande de recyclage de l'air.,Le candidat montre la commande.,Entretien technique : Savoir vérifier son véhicule est indispensable pour garantir sa sécurité et celle des autres.
49,Sécurité routière,Quel est le risque de maintenir le recyclage de manière prolongée ?,Risque de mauvaise visibilité (buée).,Sécurité Routière : Ces questions testent votre capacité à évaluer les risques et à adapter votre comportement.
49,Premiers secours,Quels sont les risques pour une personne en perte de connaissance sur le dos ?,Arrêt respiratoire et arrêt cardiaque.,"Premiers Secours : Agir vite et bien peut sauver une vie. Rappelez-vous de l'acronyme P.A.S. (Protéger, Alerter, Secourir)."
50,Vérification extérieure,Montrez l'orifice de remplissage du produit lave-glace.,Le candidat montre le bouchon.,"Visibilité : En hiver, utilisez un liquide antigel. Sans visibilité, vous êtes un danger pour vous et les autres."
50,Sécurité routière,Quel est le principal risque d'une absence de liquide lave-glace ?,Une mauvaise visibilité.,Sécurité Routière : Ces questions testent votre capacité à évaluer les risques et à adapter votre comportement.
50,Premiers secours,Pourquoi pratiquer immédiatement une RCR sur arrêt cardiaque ?,Lésions du cerveau surviennent dès les premières minutes.,Arrêt Cardiaque : Chaque minute compte. Massez le thorax et utilisez un DAE si disponible.
51,Vérification intérieure,Allumez les feux de route et montrez le voyant.,Le candidat montre le voyant (bleu).,Éclairage : Vérifiez régulièrement la propreté et le fonctionnement. Un feu grillé = mauvaise perception par les autres.
51,Sécurité routière,Quel est le risque de maintenir les feux de route lors d'un croisement ?,Risque d'éblouissement des autres.,Visibilité : Ne pas régler ses feux éblouit les autres usagers et peut provoquer un accident frontal.
51,Premiers secours,Quel est l'objectif du signal SAIP ?,Avertir d'un danger imminent.,Alerte : Le SAIP avertit d'un danger grave (sirène montante/descendante). Mettez-vous à l'abri et écoutez la radio.
52,Vérification extérieure,"Vérifiez l'état, la propreté et le fonctionnement des feux diurnes.","Vérification des feux propres, en bon état et fonctionnels.",Éclairage : Vérifiez régulièrement la propreté et le fonctionnement. Un feu grillé = mauvaise perception par les autres.
52,Sécurité routière,Quelle est leur utilité ?,Rendre le véhicule plus visible le jour.,Sécurité Routière : Ces questions testent votre capacité à évaluer les risques et à adapter votre comportement.
52,Premiers secours,À quel moment mettre fin à un appel avec les secours ?,Uniquement sur invitation du correspondant.,"Urgences : 15 (SAMU), 18 (Pompiers), 112 (Europe). Soyez précis sur le lieu et l'état des victimes."
53,Vérification intérieure,Vérifiez la présence du constat amiable.,Le candidat montre le constat.,Entretien technique : Savoir vérifier son véhicule est indispensable pour garantir sa sécurité et celle des autres.
53,Sécurité routière,"En cas d'accident, dans quel délai le transmettre à l'assureur ?",5 jours.,Sécurité Routière : Ces questions testent votre capacité à évaluer les risques et à adapter votre comportement.
53,Premiers secours,Quel est le risque principal d'un arrêt cardiaque sans intervention ?,Mort de la victime en quelques minutes.,Arrêt Cardiaque : Chaque minute compte. Massez le thorax et utilisez un DAE si disponible.
54,Vérification extérieure,Vérifiez la présence du triangle de pré-signalisation.,Le candidat montre le triangle.,Entretien technique : Savoir vérifier son véhicule est indispensable pour garantir sa sécurité et celle des autres.
54,Sécurité routière,Utilise-t-on le triangle sur autoroute ?,Non.,Sécurité Routière : Ces questions testent votre capacité à évaluer les risques et à adapter votre comportement.
54,Premiers secours,Quel comportement adopter en présence d'une victime en arrêt cardiaque ?,"Alerter, masser, défibriller.",Arrêt Cardiaque : Chaque minute compte. Massez le thorax et utilisez un DAE si disponible.
55,Vérification intérieure,De quelle couleur est le voyant de défaillance du freinage ?,Rouge.,Tableau de bord : Rouge = Danger/Arrêt. Orange = Anomalie/Attention. Vert/Bleu = Fonctionnement.
55,Sécurité routière,Quel est le risque de circuler avec un frein de parking mal desserré ?,Dégradation du système de freinage.,Freinage : Un frein à main mal desserré fait chauffer le système et réduit l'efficacité du freinage de secours.
55,Premiers secours,Comment arrêter une hémorragie ?,Appuyer fortement sur l'endroit qui saigne.,Hémorragie : Appuyez fort sur la plaie avec un tissu propre. Le but est d'arrêter la fuite de sang.
56,Vérification extérieure,Montrez où s'effectue le changement d'une ampoule à l'avant.,Le candidat montre l'accès ou le bloc optique.,Éclairage : Vérifiez régulièrement la propreté et le fonctionnement. Un feu grillé = mauvaise perception par les autres.
56,Sécurité routière,Quelles sont les conséquences en cas de panne d'un feu de croisement ?,Mauvaise visibilité et risque d'être confondu avec un deux roues.,Sécurité Routière : Ces questions testent votre capacité à évaluer les risques et à adapter votre comportement.
56,Premiers secours,Citez les trois manières d'évaluer l'état de conscience.,"Questions simples, secouer épaules, demander geste simple.","Inconscience : Si la victime respire, mettez-la en PLS (Position Latérale de Sécurité) pour libérer les voies respiratoires."
57,Vérification intérieure,"Si équipé, montrez la commande du limiteur de vitesse.",Le candidat montre la commande.,Entretien technique : Savoir vérifier son véhicule est indispensable pour garantir sa sécurité et celle des autres.
57,Sécurité routière,Quelle est l'utilité d'un limiteur de vitesse ?,Ne pas dépasser la vitesse programmée.,Sécurité Routière : Ces questions testent votre capacité à évaluer les risques et à adapter votre comportement.
57,Premiers secours,Quels sont les numéros d'urgence à appeler ?,"18, 15, 112.","Urgences : 15 (SAMU), 18 (Pompiers), 112 (Europe). Soyez précis sur le lieu et l'état des victimes."
58,Vérification extérieure,Montrez où s'effectue le changement d'une ampoule à l'arrière.,Le candidat montre l'accès ou le bloc optique.,Éclairage : Vérifiez régulièrement la propreté et le fonctionnement. Un feu grillé = mauvaise perception par les autres.
58,Sécurité routière,Quelles sont les conséquences en cas de panne d'un feu de position arrière ?,Être mal vu et un risque de collision.,Sécurité Routière : Ces questions testent votre capacité à évaluer les risques et à adapter votre comportement.
58,Premiers secours,Comment est diffusée l'alerte émise par le SAIP ?,"Sirènes, médias, application SAIP.",Alerte : Le SAIP avertit d'un danger grave (sirène montante/descendante). Mettez-vous à l'abri et écoutez la radio.
59,Vérification intérieure,Faites fonctionner l'essuie-glace arrière du véhicule.,Le candidat actionne la commande.,Essuie-glaces : Remplacez-les dès qu'ils laissent des traces. Le balayage doit être silencieux et efficace.
59,Sécurité routière,Quelle commande actionner pour une bonne visibilité par temps de pluie ?,Désembuage arrière (ou dégivrage).,Sécurité Routière : Ces questions testent votre capacité à évaluer les risques et à adapter votre comportement.
59,Premiers secours,Comportements avec une victime inconsciente mais qui respire ?,"Placer en PLS, alerter les secours, surveiller respiration.","Inconscience : Si la victime respire, mettez-la en PLS (Position Latérale de Sécurité) pour libérer les voies respiratoires."
60,Vérification extérieure,"Ouvrez et refermez le coffre, puis vérifiez sa bonne fermeture.",Le candidat effectue la manœuvre.,Entretien technique : Savoir vérifier son véhicule est indispensable pour garantir sa sécurité et celle des autres.
60,Sécurité routière,Précautions avec un poids important dans le coffre ?,Augmenter pression des pneus et régler hauteur des feux avants.,Chargement : Augmentez la pression des pneus et réglez les feux plus bas car l'arrière du véhicule s'affaisse.
60,Premiers secours,Utilisation d'un DAE sur victime non en arrêt cardiaque ?,Aucun risque (ne se déclenche pas).,Arrêt Cardiaque : Chaque minute compte. Massez le thorax et utilisez un DAE si disponible.
61,Vérification intérieure,Indiquez où se situent les attaches de type Isofix.,Le candidat montre l'emplacement.,"Isofix : Système de fixation rigide pour sièges auto, plus sûr et plus simple que la ceinture de sécurité."
61,Sécurité routière,Peut-on fixer tous les sièges enfant sur Isofix ?,Non (uniquement ceux compatibles).,"Enfants : Jusqu'à 10 ans, l'installation à l'arrière est obligatoire (sauf exceptions). La sécurité enfant bloque l'ouverture intérieure."
61,Premiers secours,Comment vérifier la respiration d'une victime ?,"Regarder si le ventre se soulève, sentir l'air.","Premiers Secours : Agir vite et bien peut sauver une vie. Rappelez-vous de l'acronyme P.A.S. (Protéger, Alerter, Secourir)."
62,Vérification extérieure,"Ouvrez et refermez le coffre, puis vérifiez sa bonne fermeture.",Le candidat effectue la manœuvre.,Entretien technique : Savoir vérifier son véhicule est indispensable pour garantir sa sécurité et celle des autres.
62,Sécurité routière,Risques avec des objets sur la plage arrière ?,Mauvaise visibilité et risque de projection.,"Objets : Sur la plage arrière, ils deviennent des projectiles mortels en cas de choc ou de freinage d'urgence."
62,Premiers secours,Qu'est-ce qu'une hémorragie ?,Perte de sang prolongée qui ne s'arrête pas.,Hémorragie : Appuyez fort sur la plaie avec un tissu propre. Le but est d'arrêter la fuite de sang.
63,Vérification intérieure,Montrez le voyant de baisse de pression d'un pneumatique.,Le candidat montre le voyant (vaisseau ouvert avec exclamation).,"Pneumatiques : Vérifiez l'état (flancs, hernies) et l'usure (témoins). Sous-gonflage = éclatement et surconsommation."
63,Sécurité routière,À quelle fréquence vérifier la pression d'air des pneus ?,Tous les mois.,Pneus : À vérifier une fois par mois à froid. Un pneu sous-gonflé chauffe et peut exploser.
63,Premiers secours,Qu'est-ce qu'un arrêt cardiaque ?,Le cœur ne fonctionne plus.,Arrêt Cardiaque : Chaque minute compte. Massez le thorax et utilisez un DAE si disponible.
64,Vérification extérieure,Procédez à l'ouverture du capot puis à sa fermeture.,Le candidat effectue la manœuvre.,Entretien technique : Savoir vérifier son véhicule est indispensable pour garantir sa sécurité et celle des autres.
64,Sécurité routière,Quelle est l'utilité du dispositif de sécurité du capot ?,Empêcher l'ouverture en circulation en cas de mauvais verrouillage.,Sécurité Routière : Ces questions testent votre capacité à évaluer les risques et à adapter votre comportement.
64,Premiers secours,Quels sont les risques pour une victime d'une hémorragie ?,Détresse circulatoire ou arrêt cardiaque.,Hémorragie : Appuyez fort sur la plaie avec un tissu propre. Le but est d'arrêter la fuite de sang.
65,Vérification intérieure,Montrez la commande de réglage de hauteur des feux.,Le candidat montre la commande.,Éclairage : Vérifiez régulièrement la propreté et le fonctionnement. Un feu grillé = mauvaise perception par les autres.
65,Sécurité routière,Pourquoi doit-on régler la hauteur des feux ?,Pour ne pas éblouir les autres.,Visibilité : Ne pas régler ses feux éblouit les autres usagers et peut provoquer un accident frontal.
65,Premiers secours,Comment et pourquoi protéger une zone de danger ?,Délimiter pour protéger et éviter sur-accident.,"PAS : Protéger est la 1ère étape. Balisez la zone (gilet, triangle) pour éviter un sur-accident."
66,Vérification extérieure,Montrez où se situent les gicleurs de lave-glace avant.,Le candidat montre l'emplacement.,"Visibilité : En hiver, utilisez un liquide antigel. Sans visibilité, vous êtes un danger pour vous et les autres."
66,Sécurité routière,Conséquence d'un lave-glace défaillant ?,Mauvaise visibilité.,Sécurité Routière : Ces questions testent votre capacité à évaluer les risques et à adapter votre comportement.
66,Premiers secours,Qu'est-ce qu'un DAE ?,Appareil rétablissant l'activité cardiaque.,Arrêt Cardiaque : Chaque minute compte. Massez le thorax et utilisez un DAE si disponible.
67,Vérification intérieure,Mettez le rétroviseur intérieur en position nuit.,Le candidat effectue la manœuvre.,Rétroviseurs : La position nuit évite l'éblouissement. Le réglage doit être fait avant de prendre la route.
67,Sécurité routière,Quel est l'intérêt de la position nuit ?,Ne pas être ébloui.,Conduite de nuit : L'éblouissement fatigue les yeux. Utilisez la position nuit du rétro et baissez vos feux si besoin.
67,Premiers secours,Comment est composé le signal SAIP ?,3 cycles SNA et signal continu.,Alerte : Le SAIP avertit d'un danger grave (sirène montante/descendante). Mettez-vous à l'abri et écoutez la radio.
68,Vérification extérieure,Contrôlez l'état du flanc sur l'un des pneus.,Vérification en bon état.,"Pneumatiques : Vérifiez l'état (flancs, hernies) et l'usure (témoins). Sous-gonflage = éclatement et surconsommation."
68,Sécurité routière,Où trouver les pressions préconisées ?,"Portière, trappe, notice.",Pneus : À vérifier une fois par mois à froid. Un pneu sous-gonflé chauffe et peut exploser.
